章节,题干,A,B,C,D,答案,难度,图片
1,马克思揭示了劳动力的本质是如何被资本主义的工资形式所掩盖的真相，对此理解正确的是（）,夸大了现象和本质的区别,否认了现象和本质的区别,揭示了现象和本质的区别,夸大了现象和本质的统一,C,中,
1,揭示事物发展是前进性和曲折性统一的规律是（  ）,联系和发展的规律,对立统一规律 ,质量互变规律,否定之否定规律,D,中,
1,“防微杜渐”体现的哲学道理是（  ）,对立统一规律的原理 ,质量互变规律的原理,否定之否定规律的原理,矛盾的同一性和斗争性关系的原理,B,中,
1,“没有无内容的空洞的形式，也没有无形式的纯粹的内容”，这一说法（）,揭示了内容与形式的联系,肯定了内容与形式的区别,否认了内容与形式的区别,夸大了形式的作用,A,中,
1,事物的否定方面是指（  ）,事物的积极方面,事物的消极方面,事物中维持其存在的方面,事物中促使其灭亡的方面,D,中,
2,马克思主义认为，从实践的活动机制看，实践是（  ）,主体与客体通过中介相互作用的过程,道德行为和政治活动,科学实验,生活、行为、现实、实事等感性活动 ,A,中,
2,实践的主体是（?????? ） ,绝对精神,具有思维能力、从事社会实践和认识活动的人,人,人的意识 ,B,中,
2,实践的客体是（  ）,绝对精神的对象化   ,客观物质世界 ,人的意识的创造物,进人主体的认识和实践范围的客观事物,D,中,
2,实践的中介是（  ）,各种形式的工具、手段及其运用的程序和方法,对一事物存在和发展有联系的各种要素的总和 ,构成事物一切要素的总和,受命于主观，见之于客观的活动 ,A,中,
2,马克思主义认为，主客体之间的价值关系是指（  ）,主体对客体的物质欲望和要求,主体对客体的能动反映 ,主体对客体的改造和变革的结果,客体对于主体的有用性和效益性,D,中,
2, “社会上一旦有技术上的需要，则这种需要会比十所大学更能把科学推向前进。”这说明（  ）,实践是认识的来源,技术推动了科学的发展 ,实践是认识发展的动力  ,科学进步是实践的目的 ,C,中,
2,恩格斯说“人的智力是按照人如何学会改变自然界而发展的。”它强调的是（）,实践是认识的来源,实践是认识的动力 ,实践是认识的目的,实践为认识提供可能性,B,中,
2,感性认识的特点是（）,直接性、形象性,逻辑性、综合性,间接性、抽象性 ,具体性、历史性,A,中,
2,“纸上得来终觉浅，绝知此事要躬行”，陆游这一名句强调的是（  ）,实践是认识的来源,实践是推动认识发展的动力,实践是认识的目的 ,间接经验毫无用处 ,C,中,
2,感性认识和理性认识的区别是（  ）,感性认识是可靠的，理性认识是不可靠的,感性认识来源于实践，理性认识来源于书本,感性认识是对现象的认识，理性认识是对本质的认识,感性认识来源于直接经验，理性认识来源于间接经验,C,中,
2,我们通过眼、耳、鼻、舌、身各种感官感觉到一个梨子的各种属性，在意识中把它们联系起来形成了关于这个梨子的感性形象，这种反映形式是（  ）,感觉,知觉,表象,分析,B,中,
2,对于哲学史上长期争论不休的唯理论和经验论两大派别的正确评价是（  ）,唯理论是正确的，经验论是错误的   ,经验论是正确的，唯理论是错误地 ,唯理论和经验论各有片面的真理性,唯理论和经验论都是完全错误的 ,C,中,
2,“真理和谬误的对立，只是在非常有限的范围内才有意义”是（  ）,形而上学的观点,唯物辩证法的观点 ,诡辩论的观点  ,相对主义的观点 ,B,中,
2,真理与谬误之间的相互关系是（  ）,在任何情况下都是绝对对立的 ,没有相互转化的可能性,在一定条件下可以互相转化,两者之间没有原则区别,C,中,
2,“真理是人造的供人使用的工具”的看法是（  ）,主观唯心主义,客观唯心主义,辩证唯物主义,机械唯物主义 ,A,中,
2,“真理是思想形式，是人类经验的组织形式”这是（  ）,主观唯心主义真理论   ,辩证唯物主义真理论,客观真理论,形而上学真理论 ,A,中,
2,“此亦一是非，彼亦一是非”的命题，其含义是（  ）,强调真理的客观性,否认真理的客观性 ,强调真理具有客观标准  ,否认真理具有客观标准 ,D,中,
2, “对客观事物的反映即是真理”，这是（  ）,混淆了真理性认识与一般认识的错误观点,辩证唯物主义的真理观 ,一切唯物主义的真理观,混淆了真理的客观性与规律客观性 ,A,中,
2, “听其言必责其用，观其行必求其功。”这种观点是（  ）,强调认识对实践的作用,强调实践对认识的检验作用,认为认识可以脱离实践  ,认为实践可以脱离认识,B,中,
2,要正确实现理性认识到实践的飞跃，必须使理论为群众所掌握，化为群众的自觉行动，这是因为（）,群众是人口中的大多数,群众是社会实践的主体,群众的意见都是正确的   ,群众的行动都是合理的,B,中,
2, “人的思维是否具有真理性，这并不是一个理论的问题，而是一个实践的问题。人应该在实践中证明自己思维的真理性，即自己思维的现实性和力量，亦即自己思维的此岸性。”这一论断说明了（  ）,实践是认识的来源和动力 ,实践是检验认识是否具有真理性的唯一标准 ,实践检验真理不需要理论指导  ,认识活动与实践活动具有同样的作用和力量 ,B,中,
2,列宁提出的：“从物到感觉和思想”与“从思想和感觉到物”是（  ）,唯物主义认识论与唯心主义认识论的对立 ,经验论与唯理论的对立 ,反映论与先验论的对立,可知论与不可知论的对立 ,A,中,
2,没有抽象的真理，真理总是具体的。这一命题强调（  ）,真理是感性的直观，不是理性的抽象,真理的内容是客观的，形式是主观的,同一对象真理性的认识只有一个 ,真理是与人的具体利益相联系的 ,C,中,
2,法国科学家路易 ? 巴斯德说：“在观察事物之际，机遇偏爱有准备的头脑。”这句话强调了（  ）,人们只有发挥主观能动性才能认识事物,人们获得感性经验至关重要 ,人们不仅要善于观察事物，而且要善于思考问题,人们在认识事物时要有理性的指导,D,中,
2,真理和谬误的界限在于（  ）,是否符合人的利益和愿望 ,是否符合马克思主义 ,是否反映了客观事物的本质和规律  ,是否为大多数人所接受,C,中,
2,真理的绝对性是指它的（  ）,具体性,客观性,终极性,全面性,B,中,
2,真理观上的相对主义，错误在于（??? ） ,夸大真理的相对性，否认真理的绝对性,夸大真理的绝对性，否认真理的相对性 ,只讲真理的客观性，否认真理的相对性,认为关于同一对象真理性的认识只有一个 ,A,中,
2,实践基础上的理论创新，是（  ）,决定了社会发展趋势,决定着社会变革力度 ,社会发展和变革的先导,一个国家兴旺发达的最终源泉 ,C,中,
2,重视理论创新，必须反对（  ）,经验主义,先验论,绝对主义,教条主义 ,D,中,
2,马克思主义认识论首要的和基本的观点是（）,唯物论的观点,实践的观点,辩证法的观点,群众的观点,B,中,
2,认识的主体是在实践中从事活动的人，认识主体的本质属性是（）,自然性,社会性,实践性,主观性,B,中,
2,主体和客体的关系，从根本上说是（）,认识关系和实践关系,认识和被认识的关系,反映和被反映的关系,主观和客观的关系,A,中,
2,只有音乐才能激起人们的音乐感，对于没有音乐感的耳朵来说，最美的音乐也毫无意义，这表明（）,人的认识是主体与客体相互作用的过程和结果,人的感觉能力决定认识的产生和发展,人的认识能力是由人的生理结构决定的,事物因人的感觉而存在,A,中,
2,“世人闻秋悲寂寥，我道秋日胜春潮。晴空一鹤排云上，便引诗情到碧霄。”从唯物论的角度看，这首诗表明（）,诗人积极向上的人生观,事物是不断运动变化发展的,人们对同一事物的反映是有差别的,实践是认识的来源，认识反作用于实践,C,中,
2,古希腊的亚里士多德提出物体的降落速度与物体的重量成正比，人们长期把它视为真理。16世纪末，伽利略通过在比萨斜塔所做的自由落体试验，推翻了亚里士多德的观点，这件事说明（）,只有理性认识才能把握事物的本质,实践是检验认识正确与否的唯一标准,实践是认识的根本目的,科学理论对实践具有指导作用,B,中,
2,“书是人类进步的阶梯”，这句话强调的是（）,直接经验的作用,间接经验的作用,感性认识的作用,理性认识的作用,B,中,
2,“在实践基础上的理论创新是社会变革的先导”这一命题（）,夸大了认识对实践的反作用,强调了认识对实践的决定作用,强调了认识对实践的能动作用,低估了实践对认识的决定作用,C,中,
2,感性认识和理性认识是辩证统一的，统一的基础是（）,认识,运动,实践,世界,C,中,
2,当我们在书中看到动物、植物等某一个具体概念时，就会在大脑中立即出现一个感性的形象与此概念相对应，这表明（）,感性认识和理性认识相互渗透,感性认识和理性认识相互转化,概念是思维的细胞和推理的工具,感性认识是理性认识的前提和基础,A,中,
2,“熟知不等于真知”这句谚语表明（）,感性认识高于理性认识,感性认识和理性认识相互依存,感性认识和理性认识相互渗透,感性认识和理性认识在内容和形式上有质的区别,D,中,
2,认识过程的第二次能动的飞跃是（）,从感性认识到实践,从实践到认识,从经验到理论,从理性认识到实践,D,中,
2,对不可知论以最有力驳斥的是（）,客观真理,客观事实,社会实践,客观规律,C,中,
2,没来科学家尼葛庞蒂说，预测未来的最好办法就是把它创造出来，从认识和实践的关系看，这句话对我们的启示是（）,认识总是滞后于实践,实践和认识互为先导,实践高于认识，因为它不仅具有普遍性品格，而且具有直接现实性品格,实践与认识是合一的,C,中,
2,“理论一定要随着实践的发展而发展，才能和变化了的客观实际相符合”，这句话表明（）,真理不是绝对的而是相对的,人们的认识能力是有限的,理论和实践是具体的、历史的统一,感性认识有待于发展到理性认识,C,中,
2,“知屋漏者在宇下，知政失者在草野。”这一古训蕴涵的哲理是（）,感性认识高于理性认识,直接经验比间接经验更重要,人的经验是判断是非得失的根本尺度,人民群众的直接经验即实践是认识的重要基础,D,中,
2,马克思主义的真理观既是唯物的，又是辩证的。真理观的辩证法表现在（）,承认客观真理和主观真理的统一,承认绝对真理和相对真理的统一,承认抽象真理和具体真理的统一,承认感性真理和理性真理的统一,B,中,
2,列宁说过：“人不能完全的把握、反映、描绘整个自然界、它的‘直接的总体’，人只能通过创立抽象、概念、规律、科学的世界图景等等永远的接近于这一点。”这句话表明（）,真理是无条件的、无限的,真理是不能把握和认识的,真理是相对性和绝对性的统一,真理只能是主观对客观事物近似正确即相对正确的反映,D,中,
2,在平面中三角形内角和等于180度，但在球面中，三角形内角和大于180度，在凹面中内角和小于180度。这说明（）,真理具有绝对性,真理具有相对性,真理具有客观性,真理具有全面性,B,中,
2,“真理是时间的女儿，不是权威的女儿”。这句名言指（）,真理和权威是相互排斥的,真理要靠历史和实践的检验,真理和权威是相互联系的,只有服从真理才具有权威,B,中,
2,列宁说，任何真理如果把它说得过火……加以夸大，把它运用到实际所能应用的范围以外去，便可以弄到荒谬绝伦的地步，而且在这种情形下，甚至必然会变成荒谬绝伦的东西。这句话揭示了真理和谬误相伴而生。真理和谬误的根本区别在于（）,是否符合人们的利益和愿望,是否经得住思想的批判,是否与客观实际相符合,是否为大多数人所接受,C,中,
2,列宁在谈到检验真理的实践标准时指出，这个标准也是这样的“不确定”，以便不至于使人的知识变成“绝对”，同时它又是这样的确定。以便同唯心主义和不可知论的一切变种进行无情的斗争。这句话说明（）,实践不是检验真理的唯一标准,实践标准并不可靠,实践标准并不确定,实践标准是绝对性和相对性的统一,D,中,
2,与经济上的价值范畴不同，哲学上的价值范畴揭示的是（）,主体客体之间改造和被改造的关系,主体客体之间认识和被认识的关系,主体客体之间反映和被反映的关系,客体以其属性满足主体需要的关系,D,中,
2,在灾难面前，所有的人都感到必须要做点什么，这种必须要做点什么的感觉，表现出人们内心有一种通过行动实现自身价值的愿望。5・12大地震。中国因为在救灾中表现出的人道主义光芒、勇敢与毅力而赢得了世界的尊敬。玉树地震，救灾再次牵动人心，社会各界在中央电视台举办的募捐晚会中募得善款21.75亿元，这表明（）,人的价值通过能力大小得到表现,人的价值通过满足个人需要得到表现,人的价值只体现在特定的场合和行为中,人的价值在满足自身和他人的需要中得到实现,D,中,
2,价值评价的认识对象是（）,价值主体的主观需要,价值客体的结构和功能,主客体之间的价值关系,主客体之间的依赖关系,C,中,
2,列宁说，必须把人的全部实践――作为真理的标准，也作为事物同人所需要它的那一点的联系的实际确定者――包括到事物的完整的“定义”中去。这句话表明（）,价值评价是一种主观随意性的认识活动,价值评价是反映了价值依赖关系的评价,实践是检验评价结果的标准,价值评价没有客观标准,C,中,
2,马克思主义认识论的根本要求和具体体现是（）,一切从实际出发,一切从根本原则出发,感性认识和理性认识的统一,认识与实践的统一,A,中,
2,马克思主义理论体系博大精深，学习马克思主义的目的不是成为困于书斋、束之高阁的谈论家，而是理论联系实际，用马克思主义指导实践。为此，要正确把握马克思主义的精髓。马克思主义的精髓是（）,辩证唯物主义,历史唯物主义,实事求是,一分为二,C,中,
2,恩格斯说“人的智力是按人如何学会改造自然界而发展的”，这句话说明（）,人具有改造世界的能力,人的认识具有主观能动性,人的认识能力是不受限制的,实践是认识发展的动力,D,中,
2,实践是认识的基础表明（）,每个人必须事事实践才能有认识,只要参加实践就一定能获得正确的认识,直接知识来自实践，间接知识不来自实践,一切认识归根到底来自实践,D,中,
2,认识的主体性原则是指（）,主观性原则,主体决定客体原则,主体的能动性原则,客体依赖主体的原则,C,中,
2,实践高于理论的认识是因为实践具有（）,普遍性,客观实在性,直接现实性,社会历史性,C,中,
2,直接经验和间接经验的关系是（）,第一性和第二性的关系,认识的“源”和“流”的关系,主观和客观的关系,反映和被反映的关系,B,中,
2,“感亦须待有物，有物则有感，无物则何所感？”这是在认识论上坚持了（）,可知论,唯物论的反映论,辩证法,唯心论的感觉论,B,中,
2,认识的起点是感觉，这是（）,只有唯物主义才承认的观点,唯物主义和唯心主义都可以承认的观点,只有辩证唯物主义才承认的观点,唯心主义承认的观点,B,中,
2,从信息的角度看，反映的发生就是（）,信息的传播过程,信息的产生过程,接受和保留信息的过程,信息的刺激过程,C,中,
2,唯物主义认识论都坚持（）,唯理论,经验论,先验论,反映论,D,中,
2,真理与价值的关系是（）,主体与客体的关系,选择与被选择的关系,第一性与第二性的关系,真理的功能与满足人的需要的关系,D,中,
2,马克思主义认识论是（  ） ,能动的反映论,经验论,先验论,不可知论,A,中,
2,“学而不思则罔”是指（）,感性认识需要上升到理性认识,理性认识需要上升到感性认识,感性认识是对事物的正确反映,理性认识是对事物的正确反映,A,中,
2,一个完整的认识过程需要经过两次飞跃。下列选项中属于第二次飞跃的是（   ）,调查研究，了解情况,深入思考，形成理论,精心安排，制定计划?,执行计划，付诸实践,D,中,
2,一个完整的认识过程是（   ）,感觉――知觉――表象,概念――判断――推理,实践――认识――实践,感性认识―理性认识―感性认识,C,中,
2,1663年，伽利略因宣传“日心说”被教廷判处终生监禁。1979年11月10日罗马教皇在公开集会上正式承认伽利略在350多年前受到教廷审判是不公正的，公开为伽利略平反。这说明（   ）,谬误可以转化为真理 ,真理在一定条件下可以转化为谬误,真理是不断发展的,真理终将战胜谬误,D,中,
2,在认识论中坚持反映论原则的是（   ）,所有唯物主义的观点,辩证唯物主义观点,机械唯物主义观点,朴素唯物主义观点,A,中,
2,要判定认识的正确与否，下列哪项不属于唯心主义判定标准（  ）,圣人意见为标准,实践标准,多数人意见为标准,以“有用”为标准,B,中,
2,毛泽东说：“马克思主义哲学认为十分重要的问题，不在于懂得了客观世界的规律性，因而能够解释世界，而在于拿了这种对于客观规律性的认识去能动的改造世界。”这段话强调的是（   ）,认识的任务在于透过事物的现象抓住事物的本质,认识的任务不仅在于解释世界，更重要的是改造世界,认识的任务在于运用客观规律解释世界,只要了解了客观规律就能成功的改造世界,B,中,
2,真理客观性的含义是指（）,真理的内容是客观的,真理是自然规律,真理是社会规律,真理是永恒的,A,中,
2,真理和价值在认识和实践中是（  ）,各自独立、毫不相干的,相互冲突、无法统一的,相互制约、相互引导、相互促进的,合二而一、无法区分的,C,中,
2,理性认识的特点是（）,直接性和现实性,间接性和抽象性,客观性和实在性,具体性和历史性,B,中,
2,感性认识的局限性在于（）,只是对事物的外部联系的认识,是不可靠的,没有客观依据,是人的感官自生的,A,中,
2,实践作为检验真理的标准，既具有确定性，又具有不确定性。实践标准之所以具有不确定性，是因为（）,真理本身具有不确定性,从事实践活动的人的世界观的差异性,不同阶级的人，具有不同的实践目的,具体的、历史的实践，总带有一定的局限性,D,,
3,社会存在是指（）,生产力各要素的总和,生产关系各方面的总和,生产力和生产关系的总和,社会物质生活条件的总和,D,中,
3,在社会发展中起决定作用的因素是（）,地理环境的优劣,物质资料的生产方式,社会风气的好坏,人口增长的快慢,B,中,
3,科学技术属于现代生产力系统的要素，这是因为（）,它是对自然界的现象及其发展规律的正确认识,它能把生产能力系统中的各要素组合成统一整体,它渗透到生产力诸要素中并转化为现实生产力,它是构成现代生产力系统的独立的实体性因素,C,中,
3,先进的社会意识之所以能对社会的发展起促进作用，是由于（）,它正确反映了社会发展规律,它是对社会存在的反映,它具有历史继承性,它具有相对独立性,A,中,
3,历史观的基本问题是（）,生产力与生产关系的关系问题,经济基础与上层建筑的关系问题,社会存在与社会意识的关系问题,社会生产与社会消费的关系问题,C,中,
3,生产力范畴反映的是（）,人与社会之间的关系,人与自然之间的关系,人与人之间的社会关系,人与劳动资料之间的关系,B,中,
3,判断一种生产关系是否先进的根本标志在于它是（）,促进生产力发展还是阻碍生产力发展,生产资料公有制还是生产资料私有制,社会化的大生产还是个体小生产,封闭的自然经济还是开放的市场经济,A,中,
3,我国社会主义初级阶段实行以公有制为主体、多种所有制经济共同发展的基本经济制度，促进了生产力的发展。说明实行这种经济制度遵循了（）,社会经济制度决定生产力状况的原理,生产力具有加速发展的原理,经济基础具有相对独立性的原理,生产力决定生产关系的原理,D,中,
3,经济基础是一定社会中（）,生产力系统各要素的总和,生产力和生产关系的总和,占统治地位的生产关系各方面的总和,占统治地位的各种社会关系的总和,C,中,
3,“社会形态的发展是一种自然历史过程”。这句话说的是（）,社会规律与自然规律没有差别,社会发展是纯粹自发的过程,人的思想动机对社会发展不起作用,社会发展具有不以人的意志为转移的客观规律性,D,中,
3,人类社会的基本矛盾是（）,生产力与生产关系、经济基础与上层建筑之间的矛盾,先进与落后之间的矛盾,封闭与开放之间的矛盾,社会存在与社会意识之间的矛盾,A,中,
3,人类社会发展的基本动力是（ ）,阶级斗争,个人和群众的矛盾,社会基本矛盾,革命和改革,C,中,
3,阶级斗争是阶级社会发展的（）,直接动力,根本动力,最终动力,唯一动力,A,中,
3,改革在历史上具有普遍性，它是（）,社会制度更替的一种形式,统治阶级向被统治阶级妥协,对社会体制进行改善和革新,革命阶级推翻反动阶级统治的斗争,C,中,
3,社会主义社会的改革是（）,改变社会主义的基本经济制度,改变社会主义的基本政治制度,改变社会主义的经济运行形式,社会主义制度的自我完善,D,中,
3,人的本质在于（）,人的自然属性,人的社会属性,人的思想品德,人的文化素质,B,中,
3,全部人类社会关系中，最基础的关系是（）,血缘亲族关系,社会生产关系,政治思想关系,阶级压迫关系,B,中,
3,“手推磨产生的是封建主为首的社会，蒸汽磨产生的是工业资本家为首的社会。”这句话是说（ ）,生产关系对生产力的反作用,生产力直接决定生产关系,生产力决定生产关系,生产力同生产关系相适应,C,中,
3,社会精神财富的源泉是（ ）,客观的物质世界,脑力劳动者的集体智慧,思想家们的创造性思维,人民群众的社会实践,D,中,
3,下列各组社会意识形式中，全部属于非意识形态的是（ ）,自然科学、逻辑学、语言学,政治思想、语言学、道德,法律思想、逻辑学、宗教,技术科学、哲学、艺术,A,中,
3,社会形态是（ ）,社会存在和社会意识的统一,地理环境、人口因素和物质资料生产方式的统一,国体与政体的统一,经济基础和上层建筑的统一,D,中,
3,人民群众是历史创造者的原理的理论前提是（ ）,社会历史是人们的活动创造的,社会历史的发展是不断进步的,社会历史的发展是有规律的,社会存在决定社会意识,A,中,
3,划分历史唯物主义和历史唯心主义的唯一标准，是看它是否承认（ ）,社会历史是发展变化的,人们的思想对社会的发展有重要作用,社会存在决定社会意识,社会历史是人们自觉活动的结果,C,中,
3,在生产力和生产关系这对矛盾中（ ）,生产力的性质决定生产关系的性质,生产力的变化落后于生产关系的变化,生产关系总是适应生产力的发展水平,生产关系可以超越生产力的发展水平,A,中,
3,经济基础决定上层建筑，说的是（ ）,任何社会的上层建筑都根源于它的经济基础,任何社会的上层建筑都产生于它的经济基础之后,上层建筑任何部分的变化都与经济基础的变化同步,上层建筑任何部分的性质都由经济基础直接决定,A,中,
3,人类全部社会关系中最基础的关系是（ ）,生产关系,家庭关系,政治关系,思想关系,A,中,
3,社会意识是（ ）,对社会存在的反映,对政治状况的反映,统治阶级意志的表现,人民群众愿望的表现,A,中,
